id,name,instructions,total_time,image,category_id
52927,Montreal Smoked Meat,"To make the cure, in a small bowl mix together salt, pink salt, black pepper, coriander, sugar, bay leaf, and cloves. Coat entire brisket with the cure and place in an extra-large resealable plastic bag. Place in the coldest part of the refrigerator and cure for 4 days, flipping brisket twice a day.
Remove brisket from bag and wash as much cure off as possible under cold running water. Place brisket in a large container and fill with water and let soak for 2 hours, replacing water every 30 minutes. Remove from water and pat dry with paper towels.
To make the rub, mix together black pepper, coriander, paprika, garlic powder, onion powder, dill weed, mustard, celery seed, and crushed red papper in a small bowl. Coat entire brisket with the rub.
Fire up smoker or grill to 225 degrees, adding chunks of smoking wood chunks when at temperature. When wood is ignited and producing smoke, place brisket in, fat side up, and smoke until an instant read thermometer registers 165 degrees when inserted into thickest part of the brisket, about 6 hours.
Transfer brisket to large roasting pan with V-rack. Place roasting pan over two burners on stovetop and fill with 1-inch of water. Bring water to a boil over high heat, reduce heat to medium, cover roasting pan with aluminum foil, and steam brisket until an instant read thermometer registers 180 degrees when inserted into thickest part of the meat, 1 to 2 hours, adding more hot water as needed.
Transfer brisket to cutting board and let cool slightly. Slice and serve, preferably on rye with mustard.",,http://res-1.cloudinary.com/dt1gn6erd/image/upload/v1634570683/a5reameglqwudddezj9y.jpg,1
52924,Nanaimo Bars,"Start by making the biscuit base. In a bowl, over a pan of simmering water, melt the butter with the sugar and cocoa powder, stirring occasionally until smooth. Whisk in the egg for 2 to 3 mins until the mixture has thickened. Remove from heat and mix in the biscuit crumbs, coconut and almonds if using, then press into the base of a lined 20cm square tin. Chill for 10 mins.
For the middle layer, make the custard icing; whisk together the butter, cream and custard powder until light and fluffy, then gradually add the icing sugar until fully incorporated. Spread over the bottom layer and chill in the fridge for at least 10 mins until the custard is no longer soft.
Melt the chocolate and butter together in the microwave, then spread over the chilled bars and put back in the fridge. Leave until the chocolate has fully set (about 2 hrs). Take the mixture out of the tin and slice into squares to serve.",,http://res-2.cloudinary.com/dt1gn6erd/image/upload/v1634570920/wlbtfr6js0kojc9rypy8.jpg,3
52923,Canadian Butter Tarts,"Preheat the oven to fan 170C/ conventional 190C/gas 5. Roll out the pastry on a lightly floured surface so it’s slightly thinner than straight from the pack. Then cut out 18-20 rounds with a 7.5cm fluted cutter, re-rolling the trimmings. Use the rounds to line two deep 12-hole tart tins (not muffin tins). If you only have a regular-sized, 12-hole tart tin you will be able to make a few more slightly shallower tarts.
Beat the eggs in a large bowl and combine with the rest of the ingredients except the walnuts. Tip this mixture into a pan and stir continuously for 3-4 minutes until the butter melts, and the mixture bubbles and starts to thicken. It should be thick enough to coat the back of a wooden spoon. Don’t overcook, and be sure to stir all the time as the mixture can easily burn. Remove from the heat and stir in the nuts.
Spoon the filling into the unbaked tart shells so it’s level with the pastry. Bake for 15-18 minutes until set and pale golden. Leave in the tin to cool for a few minutes before lifting out on to a wire rack. Serve warm or cold.",,http://res-3.cloudinary.com/dt1gn6erd/image/upload/v1634570801/o4p3mc26z4jhqbbqx1o1.jpg,3
52922,Prawn & Fennel Bisque,"Shell the prawns, then fry the shells in the oil in a large pan for about 5 mins. Add the onion, fennel and carrots and cook for about 10 mins until the veg start to soften. Pour in the wine and brandy, bubble hard for about 1 min to drive off the alcohol, then add the tomatoes, stock and paprika. Cover and simmer for 30 mins. Meanwhile, chop the prawns.
Blitz the soup as finely as you can with a stick blender or food processor, then press through a sieve into a bowl. Spend a bit of time really working the mixture through the sieve as this will give the soup its velvety texture.
Tip back into a clean pan, add the prawns and cook for 10 mins, then blitz again until smooth. You can make and chill this a day ahead or freeze it for 1 month. Thaw ovenight in the fridge. To serve, gently reheat in a pan with the cream. If garnishing, cook the 8 prawns in a little butter. Spoon into small bowls and top with the prawns and snipped fennel fronds.",,http://res-2.cloudinary.com/dt1gn6erd/image/upload/v1634569456/hizcz5jqos4szhvajebd.jpg,9
52921,Provençal Omelette Cake,"Break the eggs into two bowls, five in each. Whisk lightly and season with salt and pepper. Heat the oil in a pan, add the courgettes and spring onions, then fry gently for about 10 mins until softened. Cool, then stir into one bowl of eggs with a little salt and pepper. Add the roasted peppers to the other bowl of eggs with the garlic, chilli, salt and pepper.
Heat a little oil in a 20-23cm frying pan, preferably non-stick. Pour the eggs with courgette into a measuring jug, then pourabout one-third of the mixture into the pan, swirling it to cover the base of the pan. Cook until the egg is set and lightly browned underneath, then cover the pan with a plate and invert the omelette onto it. Slide it back into the pan to cook the other side. Repeat with the remaining mix to make two more omelettes, adding a little oil to the pan each time. Stack the omelettes onto a plate. Make three omelettes in the same way with the red pepper mixture, then stack them on a separate plate.
Now make the filling. Beat the cheese to soften it, then beat in the milk to make a spreadable consistency. Stir in the herbs, salt and pepper. Line a deep, 20-23cm round cake tin with cling film (use a tin the same size as the frying pan). Select the best red pepper omelette and place in the tin, prettiest side down. Spread with a thin layer of cheese filling, then cover with a courgette omelette. Repeat, alternating the layers, until all the omelettes and filling are in the tin, finishing with an omelette. Flip the cling film over the omelette, then chill for up to 24 hrs.
To serve, invert the omelette cake onto a serving plate and peel off the cling film. Pile rocket on the top and scatter over the cheese, a drizzle of olive oil and a little freshly ground black pepper. Serve cut into wedges.",,http://res-4.cloudinary.com/dt1gn6erd/image/upload/v1634569455/wjsnqov1ujwm2lahmnvm.jpg,12
52920,Chicken Marengo,"Heat the oil in a large flameproof casserole dish and stir-fry the mushrooms until they start to soften. Add the chicken legs and cook briefly on each side to colour them a little.
Pour in the passata, crumble in the stock cube and stir in the olives. Season with black pepper – you shouldn’t need salt. Cover and simmer for 40 mins until the chicken is tender. Sprinkle with parsley and serve with pasta and a salad, or mash and green veg, if you like.",,http://res-4.cloudinary.com/dt1gn6erd/image/upload/v1634570800/ap8fb1ss4lcpsapy9odl.jpg,2
52919,Fennel Dauphinoise,"Heat oven to 180C/160C fan/gas 4. Put potatoes, fennel, and garlic in a medium non-stick pan. Pour in milk and double cream, season well and simmer gently, covered, for 10 mins, stirring halfway through, until potatoes are just tender.
Divide the mixture between 2 small (about 150ml) buttered ramekins and scatter with Parmesan. Bake for 40 mins until the potatoes are golden and tender when pierced with a knife. Snip the reserved fennel fronds over before serving.",,http://res-2.cloudinary.com/dt1gn6erd/image/upload/v1634570415/hyxixhl1rwnsqxzumyxn.jpg,9
52918,Fish Stew with Rouille,"Twist the heads from the prawns, then peel away the legs and shells, but leave the tails intact. Devein each prawn. Fry the shells in 1 tbsp oil for 5 mins, until dark pink and golden in patches. Add the wine, boil down by two thirds, then pour in the stock. Strain into a jug, discarding the shells.
Heat the rest of the oil in a deep frying pan or casserole. Add the fennel, onion and garlic, season, then cover and gently cook for 10 mins until softened. Meanwhile, peel the potato and cut into 2cm-ish chunks. Put into a pan of cold water, bring to the boil and cook for 5 mins until almost tender. Drain in a colander.
Peel a strip of zest from the orange. Put the zest, star anise, bay and ½ tsp harissa into the pan. Fry gently, uncovered, for 5-10 mins, until the vegetables are soft, sweet and golden.
Stir in the tomato purée, cook for 2 mins, then add the tomatoes and stock. Simmer for 10 mins until the sauce thickens slightly. Season to taste. The sauce can be made ahead, then reheated later in the day. Meantime, scrub the mussels or clams and pull away any stringy beards. Any that are open should be tapped sharply on the worktop – if they don’t close after a few seconds, discard them.
Reheat the sauce if necessary, then stir the potato, chunks of fish and prawns very gently into the stew. Bring back to the boil, then cover and gently simmer for 3 mins. Scatter the mussels or clams over the stew, then cover and cook for 2 mins more or until the shells have opened wide. Discard any that remain closed. The chunks of fish should flake easily and the prawns should be pink through. Scatter with the thyme leaves.
To make the quick rouille, stir the rest of the harissa through the mayonnaise. Serve the stew in bowls, topped with spoonfuls of rouille, which will melt into the sauce and enrich it. Have some good bread ready, as you’ll definitely want to mop up the juices.",,http://res-1.cloudinary.com/dt1gn6erd/image/upload/v1634570412/xpju6qfycxkzyjby3mts.jpg,8
52916,Pear Tarte Tatin,"Core the pears, then peel as neatly as possible and halve. If you like, they can be prepared up to a day ahead and kept in the fridge, uncovered, so that they dry out.
Tip the sugar, butter, star anise, cardamom and cinnamon into an ovenproof frying pan, about 20cm wide, and place over a high heat until bubbling. Shake the pan and stir the buttery sauce until it separates and the sugar caramelises to a toffee colour.
Lay the pears in the pan, then cook in the sauce for 10-12 mins, tossing occasionally, until completely caramelised. Don’t worry about them burning – they won’t – but you want to caramelise them as much as possible. Splash in the brandy and let it flambé, then set the pears aside.
Heat oven to 200C/fan 180C/gas 6. Roll the pastry out to the thickness of a £1 coin. Using a plate slightly larger than the top of the pan, cut out a circle, then press the edges of the circle of pastry to thin them out.
When the pears have cooled slightly, arrange them in the pan, cut side up, in a floral shape, with the pears around the edge pointing inwards. Rest the cinnamon stick on the top in the centre, with the cardamom pods scattered around.
Drape the pastry over the pears, then tuck the edges down the pan sides and under the fruit (see Gordon’s guide). Pierce the pastry a few times, then bake for 15 mins. If a lot of juice bubbles up the side of the pan, pour it off at this stage (see guide). Reduce oven to 180C/fan 160C/gas 4 and bake for 15 mins more until the pastry is golden. Leave the tart to stand for 10 mins, then invert it carefully onto a serving dish.",,http://res-3.cloudinary.com/dt1gn6erd/image/upload/v1634569453/z2yqig0gtlyzhrgtew40.jpg,3
52915,French Omelette,"Get everything ready. Warm a 20cm (measured across the top) non-stick frying pan on a medium heat. Crack the eggs into a bowl and beat them with a fork so they break up and mix, but not as completely as you would for scrambled egg. With the heat on medium-hot, drop one knob of butter into the pan. It should bubble and sizzle, but not brown. Season the eggs with the Parmesan and a little salt and pepper, and pour into the pan.
Let the eggs bubble slightly for a couple of seconds, then take a wooden fork or spatula and gently draw the mixture in from the sides of the pan a few times, so it gathers in folds in the centre. Leave for a few seconds, then stir again to lightly combine uncooked egg with cooked. Leave briefly again, and when partly cooked, stir a bit faster, stopping while there’s some barely cooked egg left. With the pan flat on the heat, shake it back and forth a few times to settle the mixture. It should slide easily in the pan and look soft and moist on top. A quick burst of heat will brown the underside.
Grip the handle underneath. Tilt the pan down away from you and let the omelette fall to the edge. Fold the side nearest to you over by a third with your fork, and keep it rolling over, so the omelette tips onto a plate – or fold it in half, if that’s easier. For a neat finish, cover the omelette with a piece of kitchen paper and plump it up a bit with your fingers. Rub the other knob of butter over to glaze. Serve immediately.",,http://res-5.cloudinary.com/dt1gn6erd/image/upload/v1634570410/fpuylodtaommyexf0igv.jpg,5
52914,Boulangère Potatoes,"Heat oven to 200C/fan 180C/gas 6. Fry the onions and thyme sprigs in the oil until softened and lightly coloured (about 5 mins).
Spread a layer of potatoes over the base of a 1.5-litre oiled gratin dish. Sprinkle over a few onions (see picture, above) and continue layering, finishing with a layer of potatoes. Pour over the stock and bake for 50-60 mins until the potatoes are cooked and the top is golden and crisp.",,http://res-3.cloudinary.com/dt1gn6erd/image/upload/v1634569597/r9ffxjzemsklvqboctvy.jpg,9
52913,Brie wrapped in prosciutto & brioche,"Mix the flour, 1 tsp salt, caster sugar, yeast, milk and eggs together in a mixer using the dough attachment for 5 mins until the dough is smooth. Add the butter and mix for a further 4 mins on medium speed. Scrape the dough bowl and mix again for 1 min. Place the dough in a container, cover with cling film and leave in the fridge for at least 6 hrs before using.
Wrap the Brie in the prosciutto and set aside. Turn out the dough onto a lightly floured surface. Roll into a 25cm circle. Place the wrapped Brie in the middle of the circle and fold the edges in neatly. Put the parcel onto a baking tray lined with baking parchment and brush with beaten egg. Chill in the fridge for 30 mins, then brush again with beaten egg and chill for a further 30 mins. Leave to rise for 1 hr at room temperature. Heat oven to 200C/180C fan/gas 6, then bake for 22 mins. Serve warm.",,http://res-5.cloudinary.com/dt1gn6erd/image/upload/v1634569596/sf2tjqaxxhdhpfadhipk.jpg,9
52910,Chinon Apple Tarts,"To make the red wine jelly, put the red wine, jam sugar, star anise, clove, cinnamon stick, allspice, split vanilla pod and seeds in a medium saucepan. Stir together, then heat gently to dissolve the sugar. Turn up the heat and boil for 20 mins until reduced and syrupy. Strain into a small, sterilised jam jar and leave to cool completely. Will keep in the fridge for up to 1 month.

Take the pastry out of the fridge and leave at room temperature for 10 mins, then unroll. Heat the grill to high and heat the oven to 180C/160C fan/gas 4. Cut out 2 x 13cm circles of pastry, using a plate as a guide, and place on a non-stick baking sheet. Sprinkle each circle with 1 tbsp sugar and grill for 5 mins to caramelise, watching carefully so that the sugar doesn’t burn. Remove from the grill. Can be done a few hours ahead, and left, covered, out of the fridge.

Peel, quarter and core the apples, cut into 2mm-thin slices and arrange on top of the pastry. Sprinkle over the remaining sugar and pop in the oven for 20-25 mins until the pastry is cooked through and golden, and the apples are softened. Remove and allow to cool slightly. Warm 3 tbsp of the red wine jelly in a small pan over a low heat with 1 tsp water to make it a little more runny, then brush over the top of the tarts.

Tip the crème fraîche into a bowl, sift over the icing sugar and cardamom, and mix together. Carefully lift the warm tarts onto serving plates and serve with the cardamom crème fraîche.",,http://res-5.cloudinary.com/dt1gn6erd/image/upload/v1634570799/ah6yii9whf8mxdofjhws.jpg,3
52907,Duck Confit,"The day before you want to make the dish, scatter half the salt, half the garlic and half of the herbs over the base of a small shallow dish. Lay the duck legs, skin-side up, on top, then scatter over the remaining salt, garlic and herbs. Cover the duck and refrigerate overnight. This can be done up to 2 days ahead.
Pour the wine into a saucepan that will snugly fit the duck legs in a single layer. Brush the salt off the duck legs and place them, skin-side down, in the wine. Cover the pan with a lid and place over a medium heat. As soon as the wine starts to bubble, turn the heat down to the lowest setting and cook for 2 hours, checking occasionally that the liquid is just barely simmering. (If you own a heat diffuser, it would be good to use it here.) After 2 hours, the duck legs should be submerged in their own fat and the meat should feel incredibly tender when prodded. Leave to cool.
The duck legs are now cooked and can be eaten immediately – or you can follow the next step if you like them crisp. If you are preparing ahead, pack the duck legs tightly into a plastic container or jar and pour over the fat, but not the liquid at the bottom of the pan. Cover and leave in the fridge for up to a month, or freeze for up to 3 months. The liquid you are left with makes a tasty gravy, which can be chilled or frozen until needed.
To reheat and crisp up the duck legs, heat oven to 220C/fan 200C/gas 7. Remove the legs from the fat and place them, skin-side down, in an ovenproof frying pan. Roast for 30-40 mins, turning halfway through, until brown and crisp. Serve with the reheated gravy, a crisp salad and some crisp golden ptoatoes.",,http://res-2.cloudinary.com/dt1gn6erd/image/upload/v1634569840/op17jllfthkhe0aauc0j.jpg,5
52906,Flamiche,"For the pastry, sift the flour and salt into the bowl of a food processor, add the butter and lard, then whizz together briefly until the mixture looks like fine breadcrumbs. Tip the mixture into a bowl, then stir in the cheese and enough of the water for the mixture to come together. Tip out onto a lightly floured surface and knead briefly until smooth. Roll out thinly and line a 23cm x 4cm loose-?bottomed fluted flan tin. Prick the base with a fork. Chill for 20 minutes.
02.Melt the 75g butter in a saucepan over a low heat, then add the leeks and the salt. Cover and cook for ?10 minutes until soft. Uncover the pan, increase the heat and cook ?for 2 minutes, stirring occasionally, until the liquid has evaporated. Spoon onto a plate and leave to cool.
03.Preheat the oven to 200°C/fan180°C/gas 6. Line the pastry case with baking paper and baking beans or rice and blind bake for 15-20 minutes until the edges are biscuit-coloured. Remove the paper and beans/rice and return the case to the oven for 7-10 minutes until the base is crisp and lightly golden. Remove and set aside. Reduce the oven temperature to 190°C/fan170°C/gas 5.
04.Put the crème fraîche into a bowl with the whole egg, egg yolks and nutmeg. Lightly beat together, then season. Stir in the leeks. Spoon ?the mixture into the tart case and bake for 35-40 minutes until set ?and lightly golden. Remove from ?the oven and leave for 10 minutes. Take out of the tin and serve.",,http://res-1.cloudinary.com/dt1gn6erd/image/upload/v1634570409/sqvtwfp8njucqyxp2vah.jpg,12
52905,Chocolate Souffle,"Heat oven to 220C/fan 200C/gas 7 and place a baking tray on the top shelf. For the sauce, heat the cream and sugar until boiling. Remove from the heat, stir in the chocolate and butter until melted, then keep warm.
Brush 6 x 150ml ramekins with melted butter, sprinkle with the 2 tbsp caster sugar, then tip out any excess. Melt the chocolate and cream in a bowl over a pan of simmering water, cool, then mix in the egg yolks. Whisk the egg whites until they hold their shape, then add the sugar, 1 tbsp at a time, whisking back to the same consistency. Mix a spoonful into the chocolate, then gently fold in the rest.
Working quickly, fill the ramekins, wipe the rims clean and run your thumb around the edges. Turn oven down to 200C/fan 180C/gas 6, place the ramekins onto the baking tray, then bake for 8-10 mins until risen with a slight wobble. Don’t open the oven door too early as this may make them collapse.
Once the soufflés are ready, dust with icing sugar, scoop a small hole from their tops, then pour in some of the hot chocolate sauce. Replace the lids and serve straight away.",,http://res-1.cloudinary.com/dt1gn6erd/image/upload/v1634570797/avgzryuxmjp87dpvnmzj.jpg,3
52904,Beef Bourguignon,"Heat a large casserole pan and add 1 tbsp goose fat. Season the beef and fry until golden brown, about 3-5 mins, then turn over and fry the other side until the meat is browned all over, adding more fat if necessary. Do this in 2-3 batches, transferring the meat to a colander set over a bowl when browned.
In the same pan, fry the bacon, shallots or pearl onions, mushrooms, garlic and bouquet garni until lightly browned. Mix in the tomato purée and cook for a few mins, stirring into the mixture. This enriches the bourguignon and makes a great base for the stew. Then return the beef and any drained juices to the pan and stir through.
Pour over the wine and about 100ml water so the meat bobs up from the liquid, but isn’t completely covered. Bring to the boil and use a spoon to scrape the caramelised cooking juices from the bottom of the pan – this will give the stew more flavour.
Heat oven to 150C/fan 130C/gas 2. Make a cartouche: tear off a square of foil slightly larger than the casserole, arrange it in the pan so it covers the top of the stew and trim away any excess foil. Then cook for 3 hrs. If the sauce looks watery, remove the beef and veg with a slotted spoon, and set aside. Cook the sauce over a high heat for a few mins until the sauce has thickened a little, then return the beef and vegetables to the pan.
To make the celeriac mash, peel the celeriac and cut into cubes. Heat the olive oil in a large frying pan. Tip in the celeriac and fry for 5 mins until it turns golden. Season well with salt and pepper. Stir in the rosemary, thyme, bay and cardamom pods, then pour over 200ml water, enough to nearly cover the celeriac. Turn the heat to low, partially cover the pan and leave to simmer for 25-30 mins.
After 25-30 mins, the celeriac should be soft and most of the water will have evaporated. Drain away any remaining water, then remove the herb sprigs, bay and cardamom pods. Lightly crush with a potato masher, then finish with a glug of olive oil and season to taste. Spoon the beef bourguignon into serving bowls and place a large spoonful of the celeriac mash on top. Garnish with one of the bay leaves, if you like.",,http://res-3.cloudinary.com/dt1gn6erd/image/upload/v1634569595/gfwqgdeassdsbvblyuph.jpg,1
52903,French Onion Soup,"Melt the butter with the oil in a large heavy-based pan. Add the onions and fry with the lid on for 10 mins until soft. Sprinkle in the sugar and cook for 20 mins more, stirring frequently, until caramelised. The onions should be really golden, full of flavour and soft when pinched between your fingers. Take care towards the end to ensure that they don’t burn.
Add the garlic for the final few mins of the onions’ cooking time, then sprinkle in the flour and stir well. Increase the heat and keep stirring as you gradually add the wine, followed by the hot stock. Cover and simmer for 15-20 mins.
To serve, turn on the grill, and toast the bread. Ladle the soup into heatproof bowls. Put a slice or two of toast on top of the bowls of soup, and pile on the cheese. Grill until melted. Alternatively, you can complete the toasts under the grill, then serve them on top.",,http://res-2.cloudinary.com/dt1gn6erd/image/upload/v1634570407/b7rphtw7ey74l10pcsgj.jpg,9
52902,Parkin Cake,"Heat oven to 160C/140C fan/gas 3. Grease a deep 22cm/9in square cake tin and line with baking parchment. Beat the egg and milk together with a fork.

Gently melt the syrup, treacle, sugar and butter together in a large pan until the sugar has dissolved. Remove from the heat. Mix together the oatmeal, flour and ginger and stir into the syrup mixture, followed by the egg and milk.

Pour the mixture into the tin and bake for 50 mins - 1 hr until the cake feels firm and a little crusty on top. Cool in the tin then wrap in more parchment and foil and keep for 3-5 days before eating if you can – it’ll become softer and stickier the longer you leave it, up to 2 weeks.
",,http://res-1.cloudinary.com/dt1gn6erd/image/upload/v1634569452/cnam9hupeylm1aifo85m.jpg,3
