id,name,instructions,total_time,image,category_id
52999,Crispy Sausages and Greens,"Preheat the oven to 350°. Remove the stems from one bunch of Tuscan kale and tear the leaves into 1"" pieces (mustard greens, collards, spinach, and chard are great, too). Coarsely chop half a head of green cabbage. Combine the greens in a large baking dish and add 4 cloves of thinly sliced garlic. Adding some sliced onions and shiitake mushrooms at this point is optional, but highly recommended (I'll sauté the onions and mushrooms in a cast iron baking dish right on the stove before adding to the greens). Coat the greens with some olive oil and pour ½ cup chicken stock or broth over everything. Cover the dish with foil and bake until the greens are wilted, about 15 minutes. Remove foil and season with salt and pepper. Continue to bake until cabbage is tender, about 20-25 minutes more.

Meanwhile, heat a little olive oil in a large skillet over medium-high. Prick four sweet Italian sausages with a fork and cook until browned on all sides and cooked through, 10 to 12 minutes. When the greens are done, slice the sausage and toss into the greens with a splash of your favorite vinegar (I like sherry or red wine).",,http://res-1.cloudinary.com/dt1gn6erd/image/upload/v1634570817/zyctp4p3tg93fixdv5xv.jpg,7
52998,Corned Beef and Cabbage,"1

Place corned beef in large pot or Dutch oven and cover with water. Add the spice packet that came with the corned beef. Cover pot and bring to a boil, then reduce to a simmer. Simmer approximately 50 minutes per pound or until tender.

2

Add whole potatoes and peeled and cut carrots, and cook until the vegetables are almost tender. Add cabbage and cook for 15 more minutes. Remove meat and let rest 15 minutes.

3

Place vegetables in a bowl and cover. Add as much broth (cooking liquid reserved in the Dutch oven or large pot) as you want. Slice meat across the grain.",,http://res-3.cloudinary.com/dt1gn6erd/image/upload/v1634570815/enybadfqruzmavo9oikf.jpg,1
52997,"Beef Banh Mi Bowls with Sriracha Mayo, Carrot & Pickled Cucumber","Add'l ingredients: mayonnaise, siracha

1

Place rice in a fine-mesh sieve and rinse until water runs clear. Add to a small pot with 1 cup water (2 cups for 4 servings) and a pinch of salt. Bring to a boil, then cover and reduce heat to low. Cook until rice is tender, 15 minutes. Keep covered off heat for at least 10 minutes or until ready to serve.

2

Meanwhile, wash and dry all produce. Peel and finely chop garlic. Zest and quarter lime (for 4 servings, zest 1 lime and quarter both). Trim and halve cucumber lengthwise; thinly slice crosswise into half-moons. Halve, peel, and medium dice onion. Trim, peel, and grate carrot.

3

In a medium bowl, combine cucumber, juice from half the lime, ¼ tsp sugar (½ tsp for 4 servings), and a pinch of salt. In a small bowl, combine mayonnaise, a pinch of garlic, a squeeze of lime juice, and as much sriracha as you’d like. Season with salt and pepper.

4

Heat a drizzle of oil in a large pan over medium-high heat. Add onion and cook, stirring, until softened, 4-5 minutes. Add beef, remaining garlic, and 2 tsp sugar (4 tsp for 4 servings). Cook, breaking up meat into pieces, until beef is browned and cooked through, 4-5 minutes. Stir in soy sauce. Turn off heat; taste and season with salt and pepper.

5

Fluff rice with a fork; stir in lime zest and 1 TBSP butter. Divide rice between bowls. Arrange beef, grated carrot, and pickled cucumber on top. Top with a squeeze of lime juice. Drizzle with sriracha mayo.",,http://res-3.cloudinary.com/dt1gn6erd/image/upload/v1634569609/nnshmjrujtv1ml9mqof0.jpg,1
52996,French Onion Chicken with Roasted Carrots & Mashed Potatoes,"1

Preheat oven to 425 degrees. Wash and dry all produce. Trim, peel, and cut carrots on a diagonal into ¼-inch-thick pieces. Dice potatoes into ½-inch pieces. Halve, peel, and thinly slice onion.

2

Toss carrots on a baking sheet with a drizzle of oil, salt, and pepper. Roast until browned and tender, 15-20 minutes.

3

Meanwhile, place potatoes in a medium pot with enough salted water to cover by 2 inches. Bring to a boil and cook until tender, 12-15 minutes. Drain and return potatoes to pot; cover to keep warm.

4

While potatoes cook, heat a drizzle of oil in a large pan over medium-high heat. Add onion and cook, stirring occasionally, until lightly browned and softened, 8-10 minutes. Sprinkle with 1 tsp sugar (2 tsp for 4 servings). Stir in stock concentrate and 2 TBSP water (¼ cup for 4); season with salt and pepper. Cook until jammy, 2-3 minutes more. Turn off heat; transfer to a small bowl. Wash out pan.

5

Pat chicken dry with paper towels; season all over with salt and pepper. Heat a drizzle of oil in pan used for onion over medium-high heat. Add chicken and cook until browned and cooked through, 5-6 minutes per side. In the last 1-2 minutes of cooking, top with caramelized onion and cheese. Cover pan until cheese melts. (If your pan doesn’t have a lid, cover with a baking sheet!)

6

Heat pot with drained potatoes over low heat; mash with sour cream, 2 TBSP butter (4 TBSP for 4 servings), salt, pepper, and a splash of water (or milk, for extra richness) until smooth. Divide chicken, roasted carrots, and mashed potatoes between plates.",,http://res-5.cloudinary.com/dt1gn6erd/image/upload/v1634570417/p8y531eavrbrrzlai3fz.jpg,2
52995,BBQ Pork Sloppy Joes,"1

Preheat oven to 450 degrees. Wash and dry all produce. Cut sweet potatoes into ½-inch-thick wedges. Toss on a baking sheet with a drizzle of oil, salt, and pepper. Roast until browned and tender, 20-25 minutes.

2

Meanwhile, halve and peel onion. Slice as thinly as possible until you have ¼ cup (½ cup for 4 servings); finely chop remaining onion. Peel and finely chop garlic. Halve lime; squeeze juice into a small bowl. Halve buns. Add 1 TBSP butter (2 TBSP for 4) to a separate small microwave-safe bowl; microwave until melted, 30 seconds. Brush onto cut sides of buns.

3

To bowl with lime juice, add sliced onion, ¼ tsp sugar (½ tsp for 4 servings), and a pinch of salt. Stir to combine; set aside to quick-pickle.

4

Heat a drizzle of oil in a large pan over medium-high heat. Add chopped onion and season with salt and pepper. Cook, stirring, until softened, 4-5 minutes. Add garlic and cook until fragrant, 30 seconds more. Add pork and season with salt and pepper. Cook, breaking up meat into pieces, until browned and cooked through, 4-6 minutes.

5

While pork cooks, in a third small bowl, combine BBQ sauce, pickling liquid from onion, 3 TBSP ketchup (6 TBSP for 4 servings), ½ tsp sugar (1 tsp for 4), and ¼ cup water (⅓ cup for 4). Once pork is cooked through, add BBQ sauce mixture to pan. Cook, stirring, until sauce is thickened, 2-3 minutes. Taste and season with salt and pepper.

6

Meanwhile, toast buns in oven or toaster oven until golden, 3-5 minutes. Divide toasted buns between plates and fill with as much BBQ pork as you’d like. Top with pickled onion and hot sauce. Serve with sweet potato wedges on the side.",,http://res-5.cloudinary.com/dt1gn6erd/image/upload/v1634569608/geqdvxnlidakhi54l58a.jpg,7
52993,Honey Balsamic Chicken with Crispy Broccoli & Potatoes,"2 Servings

1. Preheat oven to 425 degrees. Wash and dry all produce. Cut potatoes into 1/2-inch-thick wedges. Toss on one side of a baking sheet with a drizzle of oil, salt, and pepper. (For 4 servings, spread potatoes out across entire sheet.) Roast on top rack for 5 minutes (we'll add the broccoli then). 

2. Meanwhile, cut broccoli florets into bite-size pieces, if necessary. Peel and finely chop garlic. In a small microwave-safe bowl, combine 1 TBSP olive oil (2 TBSP for 4 servings) and half the garlic. Microwave until garlic sizzles, 30 seconds. 

3. Once potatoes have roasted 5 minutes, remove sheet from oven and add broccoli to empty side; carefully toss with garlic oil, salt, and pepper. (For 4 servings, add broccoli to a second sheet.) Continue roasting until potatoes and broccoli are browned and crispy, 15-20 minutes more. 

4. While veggies roast, pat chicken dry with paper towels; season all over with salt and pepper. Heat a drizzle of oil in a large pan over medium-high heat. Add chicken and cook until browned and cooked through, 5-6 minutes per side. (If chicken browns too quickly, reduce heat to medium.) Turn off heat; set chicken aside to rest. Wash out pan. 

5. Heat pan used for chicken over medium-high heat. Add a drizzle of oil and remaining garlic; cook until fragrant, 30 seconds. Stir in vinegar, honey, stock concentrate, and 1/4 cup water (1/3 cup for 4 servings). Simmer until thick and glossy, 2-3 minutes. Remove from heat and stir in 1 TBSP butter (2 TBSP for 4). Season with salt and pepper. 

6. Return chicken to pan and turn to coat in glaze. Divide chicken, broccoli, and potatoes between plates. Spoon any remaining glaze over chicken and serve. ",,http://res-2.cloudinary.com/dt1gn6erd/image/upload/v1634570456/zzmhfoov70waawxvzvlr.jpg,2
52991,Mince Pies,"To make the pastry, rub 225g cold, diced butter into 350g plain flour, then mix in 100g golden caster sugar and a pinch of salt.

Combine the pastry into a ball – don’t add liquid – and knead it briefly. The dough will be fairly firm, like shortbread dough. You can use the dough immediately, or chill for later.

Preheat the oven to 200C/gas 6/fan 180C. Line 18 holes of two 12-hole patty tins, by pressing small walnut-sized balls of pastry into each hole.

Spoon 280g mincemeat into the pies.

Take slightly smaller balls of pastry than before and pat them out between your hands to make round lids, big enough to cover the pies. 

Top the pies with their lids, pressing the edges gently together to seal – you don’t need to seal them with milk or egg as they will stick on their own. (The pies may now be frozen for up to 1 month).

Beat 1 small egg and brush the tops of the pies. Bake for 20 mins until golden. Leave to cool in the tin for 5 mins, then remove to a wire rack.

To serve, lightly dust with icing sugar.",,http://res-4.cloudinary.com/dt1gn6erd/image/upload/v1634570688/pg1qynupugn0nfghgyx8.jpg,3
52990,Christmas cake,"Heat oven to 160C/fan 140C/gas 3. Line the base and sides of a 20 cm round, 7.5 cm deep cake tin. Beat the butter and sugar with an electric hand mixer for 1-2 mins until very creamy and pale in colour, scraping down the sides of the bowl half way through. Stir in a spoonful of the flour, then stir in the beaten egg and the rest of the flour alternately, a quarter at a time, beating well each time with a wooden spoon. Stir in the almonds.

Mix in the sherry (the mix will look curdled), then add the peel, cherries, raisins, cherries, nuts, lemon zest, spice, rosewater and vanilla. Beat together to mix, then stir in the baking powder.

Spoon mixture into the tin and smooth the top, making a slight dip in the centre. Bake for 30 mins, then lower temperature to 150C/fan 130C/gas 2 and bake a further 2-2¼ hrs, until a skewer insterted in the middle comes out clean. Leave to cool in the tin, then take out of the tin and peel off the lining paper. When completely cold, wrap well in cling film and foil to store until ready to decorate. The cake will keep for several months.",,http://res-3.cloudinary.com/dt1gn6erd/image/upload/v1634570814/czfemgn32w1aojhyhszv.jpg,3
52989,Christmas Pudding Trifle,"Peel the oranges using a sharp knife, ensuring all the pith is removed. Slice as thinly as possible and arrange over a dinner plate. Sprinkle with the demerara sugar followed by the Grand Marnier and set aside.

Crumble the Christmas pudding into large pieces and scatter over the bottom of a trifle bowl. Lift the oranges onto the pudding in a layer and pour over any juices.

Beat the mascarpone until smooth, then stir in the custard. Spoon the mixture over the top of the oranges.

Lightly whip the cream and spoon over the custard. Sprinkle with the flaked almonds and grated chocolate. You can make this a day in advance if you like, chill until ready to serve.",,http://res-3.cloudinary.com/dt1gn6erd/image/upload/v1634570812/gp66kuqflyxryxctby2f.jpg,3
52988,Classic Christmas pudding,"Get everything for the pudding prepared. Chop the almonds coarsely. Peel, core and chop the cooking apples. Sharpen your knife and chop the candied peel. (You can chop the almonds and apples in a food processor, but the peel must be done by hand.) Grate three quarters of the nutmeg (sounds a lot but it's correct).

Mix the almonds, apples, candied peel, nutmeg, raisins, flour, breadcrumbs, light muscovado sugar, eggs and 2 tbsp brandy or cognac in a large bowl.

Holding the butter in its wrapper, grate a quarter of it into the bowl, then stir everything together. Repeat until all the butter is grated, then stir for 3-4 mins – the mixture is ready when it subsides slightly after each stir. Ask the family to stir too, and get everyone to make a wish.

Generously butter two 1.2 litre bowls and put a circle of baking parchment in the bottom of each. Pack in the pudding mixture. Cover with a double layer of baking parchment, pleating it to allow for expansion, then tie with string (keep the paper in place with a rubber band while tying). Trim off any excess paper.

Now stand each bowl on a large sheet of foil and bring the edges up over the top, then put another sheet of foil over the top and bring it down underneath to make a double package (this makes the puddings watertight). Tie with more string, and make a handle for easy lifting in and out of the pan. Watch our video to see how to tie up a pudding correctly.

Boil or oven steam the puddings for 8 hrs, topping up with water as necessary. Remove from the pans and leave to cool overnight. When cold, discard the messy wrappings and re-wrap in new baking parchment, foil and string. Store in a cool, dry place until Christmas.

To make the brandy butter, cream the butter with the orange zest and icing sugar. Gradually beat in the brandy or cognac and chopped stem ginger. Put in a small bowl, fork the top attractively and put in the fridge to set. The butter will keep for a week in the fridge, or it can be frozen for up to six weeks.

On Christmas Day, boil or oven steam for 1 hr. Unwrap and turn out. To flame, warm 3-4 tbsp brandy in a small pan, pour it over the pudding and set light to it.",,http://res-4.cloudinary.com/dt1gn6erd/image/upload/v1634570813/wjdql01xfbi7owghbxa0.jpg,3
52987,Lasagna Sandwiches,"1. In a small bowl, combine the first four ingredients; spread on four slices of bread. Layer with bacon, tomato and cheese; top with remaining bread.

2. In a large skillet or griddle, melt 2 tablespoons butter. Toast sandwiches until lightly browned on both sides and cheese is melted, adding butter if necessary.

Nutrition Facts
1 sandwich: 445 calories, 24g fat (12g saturated fat), 66mg cholesterol, 1094mg sodium, 35g carbohydrate (3g sugars, 2g fiber), 21g protein.",,http://res-5.cloudinary.com/dt1gn6erd/image/upload/v1634570905/oxqaywlithxfz8hdq3lm.jpg,6
52979,Bitterballen (Dutch meatballs),"Melt the butter in a skillet or pan. When melted, add the flour little by little and stir into a thick paste. Slowly stir in the stock, making sure the roux absorbs the liquid. Simmer for a couple of minutes on a low heat while you stir in the onion, parsley and the shredded meat. The mixture should thicken and turn into a heavy, thick sauce.

Pour the mixture into a shallow container, cover and refrigerate for several hours, or until the sauce has solidified.

Take a heaping tablespoon of the cold, thick sauce and quickly roll it into a small ball. Roll lightly through the flour, then the egg and finally the breadcrumbs. Make sure that the egg covers the whole surface of the bitterbal. When done, refrigerate the snacks while the oil in your fryer heats up to 190C (375F). Fry four bitterballen at a time, until golden.

Serve on a plate with a nice grainy or spicy mustard. 
",,http://res-4.cloudinary.com/dt1gn6erd/image/upload/v1634569606/sziemv5tlmx2qy2skrjl.jpg,1
52978,Kumpir,"If you order kumpir in Turkey, the standard filling is first, lots of butter mashed into the potato, followed by cheese. There’s then a row of other toppings that you can just point at to your heart’s content – sweetcorn, olives, salami, coleslaw, Russian salad, allsorts – and you walk away with an over-stuffed potato because you got ever-excited by the choices on offer.

Grate (roughly – you can use as much as you like) 150g of cheese.
Finely chop one onion and one sweet red pepper.
Put these ingredients into a large bowl with a good sprinkling of salt and pepper, chilli flakes (optional).",,http://res-1.cloudinary.com/dt1gn6erd/image/upload/v1634570664/v3av6ugbsvt9jtaqkhcr.jpg,9
52977,Corba,"Pick through your lentils for any foreign debris, rinse them 2 or 3 times, drain, and set aside.  Fair warning, this will probably turn your lentils into a solid block that you’ll have to break up later
In a large pot over medium-high heat, sauté the olive oil and the onion with a pinch of salt for about 3 minutes, then add the carrots and cook for another 3 minutes.
Add the tomato paste and stir it around for around 1 minute. Now add the cumin, paprika, mint, thyme, black pepper, and red pepper as quickly as you can and stir for 10 seconds to bloom the spices. Congratulate yourself on how amazing your house now smells.
Immediately add the lentils, water, broth, and salt. Bring the soup to a (gentle) boil.
After it has come to a boil, reduce heat to medium-low, cover the pot halfway, and cook for 15-20 minutes or until the lentils have fallen apart and the carrots are completely cooked.
After the soup has cooked and the lentils are tender, blend the soup either in a blender or simply use a hand blender to reach the consistency you desire. Taste for seasoning and add more salt if necessary.
Serve with crushed-up crackers, torn up bread, or something else to add some extra thickness.  You could also use a traditional thickener (like cornstarch or flour), but I prefer to add crackers for some texture and saltiness.  Makes great leftovers, stays good in the fridge for about a week.",,http://res-1.cloudinary.com/dt1gn6erd/image/upload/v1634570810/wbu53ww0adoicdjvn2e6.jpg,9
52976,Cashew Ghoriba Biscuits,"Preheat the oven at 180 C / Gas 4. Line a baking tray with greaseproof paper.
In a bowl, mix the cashews and icing sugar. Add the egg yolks and orange blossom water and mix to a smooth homogeneous paste.
Take lumps of the cashew paste and shape into small balls. Roll the balls in icing sugar and transfer to the baking tray. Push an almond in the centre of each ghribia.
Bake until the biscuits are lightly golden, about 20 minutes. Keep an eye on them, they burn quickly.",,http://res-3.cloudinary.com/dt1gn6erd/image/upload/v1634570809/nunj8stquhlyslejzmeu.jpg,3
52974,Keleya Zaara,"Heat the vegetable oil in a large frying pan over medium-high heat. Add the lamb and cook until browned on all sides, about 5 minutes. Season with saffron, salt and pepper to taste; stir in all but 4 tablespoons of the onion, and pour in the water. Bring to the boil, then cover, reduce heat to medium-low, and simmer until the lamb is tender, about 15 minutes.
Uncover the pan, stir in the butter and allow the sauce reduce 5 to 10 minutes to desired consistency. Season to taste with salt and pepper, then pour into a serving dish. Sprinkle with the remaining chopped onions and parsley. Garnish with lemon wedges to serve.
",,http://res-4.cloudinary.com/dt1gn6erd/image/upload/v1634570663/lgos9l2iwia8lkrdmql2.jpg,4
52973,Leblebi Soup,"Heat the oil in a large pot. Add the onion and cook until translucent.
Drain the soaked chickpeas and add them to the pot together with the vegetable stock. Bring to the boil, then reduce the heat and cover. Simmer for 30 minutes.
In the meantime toast the cumin in a small ungreased frying pan, then grind them in a mortar. Add the garlic and salt and pound to a fine paste.
Add the paste and the harissa to the soup and simmer until the chickpeas are tender, about 30 minutes.
Season to taste with salt, pepper and lemon juice and serve hot.",,http://res-3.cloudinary.com/dt1gn6erd/image/upload/v1634570904/iltd8ianoy6zsyjsdryb.jpg,12
52971,Kafteji,"Peel potatoes and cut into 5cm cubes.
Pour 1-2 cm of olive oil into a large pan and heat up very hot. Fry potatoes until golden brown for 20 minutes, turning from time to time. Place on kitchen paper to drain.
Cut the peppers in half and remove seeds. Rub a little olive oil on them and place the cut side down on a baking tray. Place them under the grill. Grill until the skin is dark and bubbly. While the peppers are still hot, put them into a plastic sandwich bag and seal it. Take them out after 15 minutes and remove skins.
In the meantime, heat more olive oil another pan. Peel the onions and cut into thin rings. Fry for 15 minutes until golden brown, turning them often. Add the Ras el hanout at the end.
Cut the pumpkin into 5cm cubes and fry in the same pan you used for the potatoes for 10-15 minutes until it is soft and slightly browned. Place on kitchen paper.
Pour the remaining olive oil out of the pan and put all the cooked vegetables into the pan and mix. Whisk eggs and pour them over the vegetables. Put the lid on the pan so that the eggs cook. Put the contents of the pan onto a large chopping board, add salt and pepper and chopped and mix everything with a big knife.",,http://res-2.cloudinary.com/dt1gn6erd/image/upload/v1634570662/yppir0rlqzxiyvbwzlxn.jpg,12
52969,Chakchouka,"In a large cast iron skillet or sauté pan with a lid, heat oil over medium high heat. Add the onion and sauté for 2-3 minutes, until softened. Add the peppers and garlic, and sauté for an additional 3-5 minutes. Add the tomatoes, cumin, paprika, salt, and chili powder. Mix well and bring the mixture to a simmer. Reduce the heat to medium low and continue to simmer, uncovered, 10-15 minutes until the mixture has thickened to your desired consistency. (Taste the sauce at this point and adjust for salt and spice, as desired.) Using the back of a spoon, make four craters in the mixture, large enough to hold an egg. Crack one egg into each of the craters. Cover the skillet and simmer for 5-7 minutes, until the eggs have set. Serve immediately with crusty bread or pita.",,http://res-5.cloudinary.com/dt1gn6erd/image/upload/v1634570808/wlsxmh8lwxfuu580vlp5.jpg,5
52968,Mbuzi Choma (Roasted Goat),"1. Steps for the Meat: 
 Roast meat over medium heat for 50 minutes and salt it as you turn it.

2. Steps for Ugali:
Bring the water and salt to a boil in a heavy-bottomed saucepan. Stir in the cornmeal slowly, letting it fall through the fingers of your hand.

3. Reduce heat to medium-low and continue stirring regularly, smashing any lumps with a spoon, until the mush pulls away from the sides of the pot and becomes very thick, about 10 minutes.

4.Remove from heat and allow to cool.

5. Place the ugali into a large serving bowl. Wet your hands with water, form a ball and serve.

6. Steps for Kachumbari: Mix the tomatoes, onions, chili and coriander leaves in a bowl.

7. Serve and enjoy!

",,http://res-3.cloudinary.com/dt1gn6erd/image/upload/v1634570686/zzx7bdvnrecgwxl8klzj.jpg,14
52967,Home-made Mandazi,"This is one recipe a lot of people have requested and I have tried to make it as simple as possible and I hope it will work for you. Make sure you use the right flour which is basically one with raising agents. Adjust the amount of sugar to your taste and try using different flavours to have variety whenever you have them.
You can use Coconut milk instead of regular milk, you can also add desiccated coconut to the dry flour or other spices like powdered cloves or cinnamon.
For “healthy looking” mandazis do not roll the dough too thin before frying and use the procedure I have indicated above.

1. Mix the flour,cinnamon and sugar in a suitable bowl.
2. In a separate bowl whisk the egg into the milk
3. Make a well at the centre of the flour and add the milk and egg mixture and slowly mix to form a dough.
4. Knead the dough for 3-4 minutes or until it stops sticking to the sides of the bowl and you have a smooth surface.
5. Cover the dough with a damp cloth  and allow to rest for 15 minutes.
6. Roll the dough on a lightly floured surface into a 1cm thick piece.
7. Using a sharp small knife, cut the dough into the desired size setting aside ready for deep frying.
8. Heat your oil in a suitable pot and gently dip the mandazi pieces to cook until light brown on the first side then turn to cook on the second side.
9. Serve them warm or cold",,http://res-1.cloudinary.com/dt1gn6erd/image/upload/v1634570455/qygzv0it5dflyiy5q8vc.jpg,13
52966,Chocolate Caramel Crispy,"Grease and line a 20 x 20cm/8"" x 8"" baking tin with parchment paper.
Put the mars bars and butter in a heat proof bowl and place over a pan of barely simmering water. Mixing with a whisk, melt until the mixture is smooth.
Pour over the rice krispies in a mixing bowl and mix until all the ingredients are evenly combined. Press evenly into the prepare baking tin and set aside.
Melt the milk chocolate in the microwave or over a pan of barely simmering water.
Spread the melted chocolate over the rice krispie mixture and leave to set in a cool place. Once set slice into squares and serve!",,http://res-3.cloudinary.com/dt1gn6erd/image/upload/v1634570806/jdslmvqdwvsd0imvrq7b.jpg,3
