id,name,instructions,total_time,image,category_id
53063,Chivito uruguayo,"Crush the meat so that it is finite and we put it on a griddle to brown. Put the eggs, bacon and ham to fry.
Cut the bread in half, put the beef brisket, the fried eggs, the bacon, the ham, the mozzarella, the tomato and the lettuce. Cover with the other half of the bread and serve.",,http://res-5.cloudinary.com/dt1gn6erd/image/upload/v1634570825/dijqp6ph9nfdwmf1mcvg.jpg,1
53061,Fresh sardines,Wash the fish under the cold tap. Roll in the flour and deep fry in oil until crispy. Lay on kitchen towel to get rid of the excess oil and serve hot or cold with a slice of lemon.,,http://res-5.cloudinary.com/dt1gn6erd/image/upload/v1634570422/lv4jrf7ixmpwqjphrhwi.jpg,9
53060,Burek,"Fry the finely chopped onions and minced meat in oil. Add the salt and pepper. Grease a round baking tray and put a layer of pastry in it. Cover with a thin layer of filling and cover this with another layer of filo pastry which must be well coated in oil. Put another layer of filling and cover with pastry. When you have five or six layers, cover with filo pastry, bake at 200ºC/392ºF for half an hour and cut in quarters and serve.",,http://res-1.cloudinary.com/dt1gn6erd/image/upload/v1634569615/ns2xzdd97tg97dh5gssn.jpg,9
53059,Mushroom soup with buckwheat,"Chop the onion and garlic, slice the mushrooms and wash the buckwheat. Heat the oil and lightly sauté the onion. Add the mushrooms and the garlic and continue to sauté. Add the salt, vegetable seasoning, buckwheat and the bay leaf and cover with water. Simmer gently and just before it is completely cooked, add pepper, sour cream mixed with flour, the chopped parsley and vinegar to taste.",,http://res-1.cloudinary.com/dt1gn6erd/image/upload/v1634570695/zhyitshjnyxyqmeic8go.jpg,9
53058,Croatian Bean Stew,"Heat the oil in a pan. Add the chopped vegetables and sauté until tender. Take a pot, empty the beans together with the vegetables into it, put the sausages inside and cook for further 20 minutes on a low heat. Or, put it in an oven and bake it at a temperature of 180ºC/350ºF for 30 minutes. This dish is even better reheated the next day.",,http://res-5.cloudinary.com/dt1gn6erd/image/upload/v1634570824/nwiiuzemz67xr54sqtql.jpg,1
53056,Croatian lamb peka,"Preheat oven to 200°C fan / 220°C / 425°F / Gas mark 7
If you have not bought diced lamb, cut your lamb shoulder or leg into large chunks and place to one side.
Chunks of chopped lamb of a red chopping board
Make oil marinade -
Mix 80ml of olive oil in a bowl with garlic puree, sundried tomato puree ,black pepper and salt.
olive oil, gia sundried tomato puree and gia garlic puree and black pepper mixed together in a silver bowl to make Croatian peka
Add potatoes and vegetables into a large lidded casserole dish.
Chopped up vegetables which consist of chopped up red onion, courgette, potatoes red peppers in a cast iron pan
Place diced lamb on top of the vegetables, pour the marinade and wine over the top.
Chunks of lamb covered in in a sundried tomato oil sauce which is on top of chopped red onion, aubergine, courgette and potatoes in a cast iron pan
Add the rosemary, thyme and sage, trying to keep the herbs on top.
So you can easily remove the herb stalks once cooked.
Chunks of lamb coated in a sundried tomato oil sauce and covered with thyme, rosemary and sage which is on top of chopped red onion, aubergine, courgette and potatoes in a cast iron pan
Place lid on the casserole dish and cook for 1hr 30 minute
If you do not have a lid cover very well with kitchen foil
Cast iron dish with lid on in the oven
Take the lid off, remove any thick herb stems. Stir in 2 tbsp of olive oil.
Cook for a further 20-30 mins.
Cooked Croatian Lamb Peka in a cast iron pan in the oven
Serve with fresh homemade bread to dip into the juices.",,http://res-1.cloudinary.com/dt1gn6erd/image/upload/v1634570823/oqsjxmdgukmps5duahdq.jpg,1
53055,Cevapi Sausages,"Place the ground meat in a bowl. Chop the onion very finely and grate the garlic cloves. Add to the bowl. Add the chopped parsley, all sorts of paprika, baking soda, dried breadcrumbs, water, Vegeta, salt, and pepper.
Mix well with the hand mixer fitted with the dough hooks. Cover the bowl with cling film/ plastic foil and leave to rest for 1 or 2 hours in the refrigerator.
Take portions of the meat mixture, about 50-55 g/ 1.7-1.9 oz/ ¼ cup portions, and form the cevapi. The rolls should be about as thick as your thumb and about 7-10 cm/ 3-4 inches long. I had 18 sausages. The recipe can be easily doubled.
Grill the cevapcici on the hot grill pan or on the barbecue for about 12-14 minutes, turning them several times in between, or until brown and cooked through. I checked by cutting one in the middle and then grilling the following batches for the same period of time.
Serve hot as suggested above. The cevapcici can be reheated in the oven at 180 degrees Celsius/ 350 degrees Fahrenheit for about 10 minutes or until heated through. Check one, if it is not hot enough, give the sausages a few more minutes.",,http://res-2.cloudinary.com/dt1gn6erd/image/upload/v1634570822/mps0mt2yuagb89hfundj.jpg,1
53053,Beef Rendang,"Chop the spice paste ingredients and then blend it in a food processor until fine.
Heat the oil in a stew pot, add the spice paste, cinnamon, cloves, star anise, and cardamom and stir-fry until aromatic. Add the beef and the pounded lemongrass and stir for 1 minute. Add the coconut milk, tamarind juice, water, and simmer on medium heat, stirring frequently until the meat is almost cooked. Add the kaffir lime leaves, kerisik (toasted coconut), sugar or palm sugar, stirring to blend well with the meat.
Lower the heat to low, cover the lid, and simmer for 1 to 1 1/2 hours or until the meat is really tender and the gravy has dried up. Add more salt and sugar to taste. Serve immediately with steamed rice and save some for overnight.",,http://res-4.cloudinary.com/dt1gn6erd/image/upload/v1634569614/yqieeamn9lnsvmcpcxql.jpg,1
53051,Nasi lemak,"In a medium saucepan over medium heat, stir together coconut milk, water, ground ginger, ginger root, salt, bay leaf, and rice. Cover, and bring to a boil. Reduce heat, and simmer for 20 to 30 minutes, or until done.

 Step 2
Place eggs in a saucepan, and cover with cold water. Bring water to a boil, and immediately remove from heat. Cover, and let eggs stand in hot water for 10 to 12 minutes. Remove eggs from hot water, cool, peel and slice in half. Slice cucumber.

 Step 3
Meanwhile, in a large skillet or wok, heat 1 cup vegetable oil over medium-high heat. Stir in peanuts and cook briefly, until lightly browned. Remove peanuts with a slotted spoon and place on paper towels to soak up excess grease. Return skillet to stove. Stir in the contents of one package anchovies; cook briefly, turning, until crisp. Remove with a slotted spoon and place on paper towels. Discard oil. Wipe out skillet.

 Step 4
Heat 2 tablespoons oil in the skillet. Stir in the onion, garlic, and shallots; cook until fragrant, about 1 or 2 minutes. Mix in the chile paste, and cook for 10 minutes, stirring occasionally. If the chile paste is too dry, add a small amount of water. Stir in remaining anchovies; cook for 5 minutes. Stir in salt, sugar, and tamarind juice; simmer until sauce is thick, about 5 minutes.

 Step 5
Serve the onion and garlic sauce over the warm rice, and top with peanuts, fried anchovies, cucumbers, and eggs.",,http://res-2.cloudinary.com/dt1gn6erd/image/upload/v1634570921/va86d7me0zdwakn5gtts.jpg,8
53050,Ayam Percik,"In a blender, add the ingredients for the spice paste and blend until smooth.
Over medium heat, pour the spice paste in a skillet or pan and fry for 10 minutes until fragrant. Add water or oil 1 tablespoon at a time if the paste becomes too dry. Don't burn the paste. Lower the fire slightly if needed.
Add the cloves, cardamom, tamarind pulp, coconut milk, water, sugar and salt. Turn the heat up and bring the mixture to boil. Turn the heat to medium low and simmer for 10 minutes. Stir occasionally. It will reduce slightly. This is the marinade/sauce, so taste and adjust seasoning if necessary. Don't worry if it's slightly bitter. It will go away when roasting.
When the marinade/sauce has cooled, pour everything over the chicken and marinate overnight to two days.
Preheat the oven to 425 F.
Remove the chicken from the marinade. Spoon the marinade onto a greased (or aluminum lined) baking sheet. Lay the chicken on top of the sauce (make sure the chicken covers the sauce and the sauce isn't exposed or it'll burn) and spread the remaining marinade on the chicken. Roast for 35-45 minutes or until internal temp of the thickest part of chicken is at least 175 F.
Let chicken rest for 5 minutes. Brush the chicken with some of the oil. Serve chicken with the sauce over steamed rice (or coconut rice).",,http://res-4.cloudinary.com/dt1gn6erd/image/upload/v1634569556/s8ibakzsqrlrvdnpzq1f.jpg,2
53049,Apam balik,"Mix milk, oil and egg together. Sift flour, baking powder and salt into the mixture. Stir well until all ingredients are combined evenly.

Spread some batter onto the pan. Spread a thin layer of batter to the side of the pan. Cover the pan for 30-60 seconds until small air bubbles appear.

Add butter, cream corn, crushed peanuts and sugar onto the pancake. Fold the pancake into half once the bottom surface is browned.

Cut into wedges and best eaten when it is warm.",,http://res-4.cloudinary.com/dt1gn6erd/image/upload/v1634569555/lhb5goqftdb6v9jfexs9.jpg,3
53048,Mee goreng mamak,"Heat oil in a pan at medium heat. Then, add peanuts, dried chilies, dried shrimps and dhal. Fry the aromatics until fragrant. Remove from pan and leave aside.

Blend fried ingredients with tamarind paste and water until fine. Then, sauté the blended ingredients in oil heated over low heat. Continue cooking until the oil separates from the paste and turns a darker shade.

Skin and cut potatoes into small chunks and boil them in a pot of water until knife-tender. Once ready, remove them from the pot and leave aside. Discard water.

Slice onion and fried tofu, mince garlic, cut some cabbage and Chinese flowering cabbage (choi sam). Prepare prawn fritters and cut them. Boil noodles to soften them if bought dried. Also mix black soy sauce with water.

To fry one portion of mee goreng mamak, heat oil and add 1/4 of the following ingredients in this order: garlic, onion, paste. Sauté until fragrant. Optionally, add prawns.

Add in 1/4 amount of tofu, boiled potatoes, cabbage, Chinese flowering cabbage and prawn fritters. Sauté for another 30 seconds.

Add noodles to the wok. Add 3 tablespoons of dark soy sauce mixture. Mix evenly for the next 1 minute. Then, move the noodles to the side of the wok. Stir in an egg. Garnish with a slice of lime and slices of green chilies. To cook another plate of noodles, repeat from step 5 onwards.",,http://res-5.cloudinary.com/dt1gn6erd/image/upload/v1634570694/klhzevcyxrhufg35oxv8.jpg,8
53047,Moroccan Carrot Soup,"Step 1
Preheat oven to 180° C.
Step 2
Combine carrots, onion, garlic, cumin seeds, coriander seeds, salt and olive oil in a bowl and mix well. Transfer on a baking tray.
Step 3
Put the baking tray in preheated oven and roast for 10-12 minutes or till carrots soften. Remove from heat and cool.
Step 4
Grind the baked carrot mixture along with some water to make a smooth paste and strain in a bowl.
Step 5
Heat the carrot mixture in a non-stick pan. Add two cups of water and bring to a boil. Add garam masala powder and mix. Add salt and mix well.
Step 6
Remove from heat, add lemon juice and mix well.
Step 7
Serve hot.",,http://res-5.cloudinary.com/dt1gn6erd/image/upload/v1634570692/vfnyrarysy8ljqipes4v.jpg,12
53046,Portuguese custard tarts,"STEP 1
Roll the pastry
Mix the flour and icing sugar, and use this to dust the work surface. Roll the pastry out to make a 45 x 30cm rectangle. Roll up lengthways to create a long sausage shape.

STEP 2
Cutting pastry into rounds
Cut the pastry into 24 wheels, about 1-2cm thick.

STEP 3
Roll out each pastry portion
Roll each wheel lightly with the rolling pin to fit 2 x 12-hole non-stick fairy cake tins.

STEP 4
Press pastry into the tin
Press the pastry circles into the tins and mould into the tins to make thin cases. Chill until needed.

STEP 5
Make the infused syrup
Heat the oven to 220C/fan 200C/gas 7. Make a sugar syrup by bringing the sugar, 200ml water, lemon zest and cinnamon stick to the boil. Reduce until syrupy, allow to cool, then remove the cinnamon and lemon. Whisk the eggs, egg yolks and cornflour until smooth in another large pan.

STEP 6
Making custard
Heat the milk and vanilla pod seeds in a separate pan until just below the boil. Gradually pour the hot milk over the eggs and cornflour, then cook on a low heat, continually whisking.

STEP 7
Add syrup to custard
Add the cooled sugar syrup to the custard and whisk until thickened slightly.

STEP 8
Pour custard into the tins
Pour the custard through a sieve. Pour into the pastry cases and bake for 15 minutes until the pastry is golden and the custard has darkened.

STEP 9
cool and dust with icing sugar
Cool completely in the tins then sift over icing sugar and ground cinnamon to serve.



 ",,http://res-3.cloudinary.com/dt1gn6erd/image/upload/v1634569472/routjmdeeb4nb3u0yip8.jpg,3
53045,Portuguese fish stew (Caldeirada de peixe),"STEP 1

Heat a drizzle of oil in a large, deep-sided frying pan, and fry the onion and pepper on a medium heat until softened but not browned. Finely chop the coriander stalks (keep the leaves for later), and add to the pan with the chilli and chopped garlic. Fry for another few minutes. Add the wine, saffron and bay leaf and let it simmer until reduced by half.

STEP 2

Add the potatoes, tomatoes, and 300ml water and bring to a gentle boil. Break up the tomatoes with a spoon on the side of the pan and simmer for 20-25 minutes until the potatoes are just tender, and the tomatoes have broken down.

STEP 3

Season well, then gently push the fish into the sauce, and arrange the squid, prawns, clams and mussels on the surface. Put the lid on and cook for 6-8 minutes until the mussel and clam shells have opened, the prawns are cooked and the fish is flaky. Toast the bread, rub lightly with the halved garlic clove and drizzle with olive oil. Serve the stew scatted with chopped coriander leaves, and the toasts for dunking.",,http://res-3.cloudinary.com/dt1gn6erd/image/upload/v1634569471/h8glbmqzqjnvxjfhvsch.jpg,8
53044,Portuguese barbecued pork (Febras assadas),"STEP 1

Cut the tenderloins into 5 equal-size pieces leaving the tail ends a little longer. Take a clear plastic bag and slip one of the pieces in. Bash it into an escalope the size of a side-plate with a rolling pin and repeat with the remaining pieces.

STEP 2

Put the wine, paprika, some salt and pepper and the juice of ½ a lemon in a bowl and add the pork. Leave to marinate for 20-30 minutes, while you get your barbecue to the stage where the coals are glowing but there are no flames.

STEP 3

To make the chips, fill a basin with cool water and cut the potatoes into 3cm-thick chips. Soak them in the water for 5 minutes and then change the water. Leave for 5 more minutes. Drain and then pat dry on a towel or with kitchen paper.

STEP 4

Heat the oil in a deep fryer or a deep heavy-based pan with a lid to 130C and lower the chips into the oil (in batches). Blanch for 8-10 minutes. Remove from the oil and drain well. Place on a tray to cool. Reheat the oil to 180C (make sure it’s hot or your chips will be soggy) and lower the basket of chips into the oil (again, do this in batches). Leave to cook for 2 minutes and then give them a little shake. Cook for another minute or so until they are well coloured and crisp to the touch. Drain well for a few minutes, tip into a bowl and sprinkle with sea salt.

STEP 5

The pork will cook quickly so do it in 2 batches. Take the pieces out of the marinade, rub them with oil, and drop them onto the barbecue (you could also use a chargrill). Cook for 1 minute on each side – they may flare up as you do so. This should really be enough time as they will keep on cooking. Take them off the barbecue and pile onto a plate. Repeat with the remaining batch.

STEP 6

Serve by piling a plate with chips, drop the pork on top of each pile and pouring the juices from the plate over so the chips take up the flavours. Top with a spoon of mayonnaise and a wedge of lemon.",,http://res-1.cloudinary.com/dt1gn6erd/image/upload/v1634569470/irllvtuabjsqflhj4yve.jpg,7
53043,Fish fofos,"STEP 1

Put the fish into a lidded pan and pour over enough water to cover. Bring to a simmer and gently poach for 10 minutes over a low heat with the lid on. Drain and flake the fish.

STEP 2

Put the fish, potato, green chilli, coriander, cumin, black pepper, garlic and ginger in a large bowl. Season, add the rice flour, mix well and break in 1 egg. Stir the mixture and divide into 15, then form into small logs. Break the remaining eggs into a bowl and whisk lightly. Put the breadcrumbs into another bowl. Dip each fofo in the beaten egg followed by the breadcrumb mixture. Chill for 20 minutes.

STEP 3

Heat 1cm of oil in a large frying pan over a medium heat. Fry the fofos in batches for 2 minutes on each side, turning gently to get an even golden brown colour all over. Drain on kitchen paper and repeat with the remaining fofos.

STEP 4

For the onion salad, mix together the onion, coriander and lemon juice with a pinch of salt. Serve with the fofos and mango chutney.",,http://res-1.cloudinary.com/dt1gn6erd/image/upload/v1634570421/xbvqgvuzslfk9hiqi313.jpg,8
53042,Portuguese prego with green piri-piri,"STEP 1

Rub the garlic over the steaks then put in a sandwich bag and tip in the olive oil, sherry vinegar and parsley stalks. Smoosh everything together, then use a rolling pin to bash the steaks a few times. Leave for 1-2 hours.

STEP 2

To make the sauce, put all the ingredients into a blender with 1 tbsp water and whizz until as smooth as possible. This will make more than you’ll need for the recipe but will keep for a week in an airtight jar.

STEP 3

Heat a griddle or frying pan to high. Brush away the garlic and parsley stalks from the steaks and season well. Sear the steaks for 2 minutes on each side then rest on a plate. Put the ciabatta halves onto the plate, toasted-side down, to soak up any juices.

STEP 4

Slice the steaks then stuff into the rolls with the green sauce and rocket.",,http://res-5.cloudinary.com/dt1gn6erd/image/upload/v1634569469/dorba0tqkgilfi920xgt.jpg,1
53041,Grilled Portuguese sardines,"STEP 1

Put all of the ingredients, except the sardines, into a bowl and mix together with some seasoning. Pour into a baking dish, add the sardines and toss really well. Cover and chill for a few hours.

STEP 2

Heat a BBQ or griddle pan until hot. Cook the sardines for 4-5 minutes on each side or until really caramelised and charred. Put onto a serving plate, drizzle with oil, sprinkle with a little more paprika and squeeze over the lemon wedges.",,http://res-4.cloudinary.com/dt1gn6erd/image/upload/v1634570840/hrq4mnq6q2bxisbeuo4g.jpg,8
53039,Piri-piri chicken and slaw,"STEP 1

Whizz together all of the marinade ingredients in a small food processor. Rub the marinade onto the chicken and leave for 1 hour at room temperature.

STEP 2

Heat the oven to 190C/fan 170C/gas 5. Put the chicken in a roasting tray and cook for 1 hour 20 minutes. Rest under loose foil for 20 minutes. While the chicken is resting, mix together the slaw ingredients and season. Serve the chicken with slaw, fries and condiments.",,http://res-2.cloudinary.com/dt1gn6erd/image/upload/v1634569467/vpy27nc8affxjpdy0hs2.jpg,2
53038,Mustard champ,"STEP 1
Boil the potatoes for 15 mins or until tender. Drain, then mash.

STEP 2
Heat the milk and half the butter in the corner of the pan, then beat into the mash, along with the wholegrain mustard.

STEP 3
Gently fry the spring onions in the remaining butter for 2 mins until just soft but still a perky green. Fold into the mash and serve. Great with gammon or to top a fish pie.",,http://res-3.cloudinary.com/dt1gn6erd/image/upload/v1634570691/pcwzjqgcjzentky2emlt.jpg,9
53037,Coddled pork with cider,"STEP 1
Heat the butter in a casserole dish until sizzling, then fry the pork for 2-3 mins on each side until browned. Remove from the pan.

STEP 2
Tip the bacon, carrot, potatoes and swede into the pan, then gently fry until slightly coloured. Stir in the cabbage, sit the chops back on top, add the bay leaf, then pour over the cider and stock. Cover the pan, then leave everything to gently simmer for 20 mins until the pork is cooked through and the vegetables are tender.

STEP 3
Serve at the table spooned straight from the dish.",,http://res-2.cloudinary.com/dt1gn6erd/image/upload/v1634570820/aiminzu7zs8sjmm012fv.jpg,7
53036,Boxty Breakfast,"STEP 1
Before you start, put your oven on its lowest setting, ready to keep things warm. Peel the potatoes, grate 2 of them, then set aside. Cut the other 2 into large chunks, then boil for 10-15 mins or until tender. Meanwhile, squeeze as much of the liquid from the grated potatoes as you can using a clean tea towel. Mash the boiled potatoes, then mix with the grated potato, spring onions and flour.

STEP 2
Whisk the egg white in a large bowl until it holds soft peaks. Fold in the buttermilk, then add the bicarbonate of soda. Fold into the potato mix.

STEP 3
Heat a large non-stick frying pan over a medium heat, then add 1 tbsp butter and some of the oil. Drop 3-4 spoonfuls of the potato mixture into the pan, then gently cook for 3-5 mins on each side until golden and crusty. Keep warm on a plate in the oven while you cook the next batch, adding more butter and oil to the pan before you do so. You will get 16 crumpet-size boxty from the mix. Can be made the day ahead, drained on kitchen paper, then reheated in a low oven for 20 mins.

STEP 4
Heat the grill to medium and put the tomatoes in a heavy-based pan. Add a good knob of butter and a little oil, then fry for about 5 mins until softened. Grill the bacon, then pile onto a plate and keep warm. Stack up the boxty, bacon and egg, and serve the tomatoes on the side.",,http://res-3.cloudinary.com/dt1gn6erd/image/upload/v1634569613/admjtmuhhaabrxzmbw3n.jpg,7
53035,Ham hock colcannon,"STEP 1
Peel and cut the potatoes into even, medium-sized chunks. Put in a large pan filled with cold salted water, bring to the boil and cook for 10-15 mins until a knife can be inserted into the potatoes easily.

STEP 2
Meanwhile, melt the butter in a large sauté pan over a medium heat. Add the garlic, cabbage, spring onions and some seasoning. Stir occasionally until the cabbage is wilted but still retains a little bite, then set aside.

STEP 3
Drain the potatoes, leave to steam-dry for a couple of mins, then mash with the cream, mustard and seasoning in the same saucepan. Stir in the cabbage and ham hock. Keep warm over a low heat.

STEP 4
Reheat the pan you used to cook the cabbage (no need to wash first), add a splash of oil, crack in the eggs and fry to your liking. To serve, divide the colcannon between bowls and top each with a fried egg.",,http://res-5.cloudinary.com/dt1gn6erd/image/upload/v1634570460/dfnsv67gi5ocqoznwfwf.jpg,7
53034,Japanese Katsudon,"STEP 1
Heat the oil in a pan, fry the sliced onion until golden brown, then add the tonkatsu (see recipe here), placing it in the middle of the pan. Mix the dashi, soy, mirin and sugar together and tip three-quarters of the mixture around the tonkatsu. Sizzle for a couple of mins so the sauce thickens a little and the tonkatsu reheats.

STEP 2
Tip the beaten eggs around the tonkatsu and cook for 2-3 mins until the egg is cooked through but still a little runny. Divide the rice between two bowls, then top each with half the egg and tonkatsu mix, sprinkle over the chives and serve immediately, drizzling with a little more soy if you want an extra umami kick.",,http://res-4.cloudinary.com/dt1gn6erd/image/upload/v1634570642/vtiza2x05jpqhqpdztbq.jpg,7
53033,Japanese gohan rice,"STEP 1
Rinsing and soaking your rice is key to achieving the perfect texture. Measure the rice into a bowl, cover with cold water, then use your fingers to massage the grains of rice – the water will become cloudy. Drain and rinse again with fresh water. Repeat five more times until the water stays clear.

STEP 2
Tip the rinsed rice into a saucepan with 400ml water, or 200ml dashi and 200ml water, bring to the boil, then turn down the heat to a low simmer, cover with a tight-fitting lid with a steam hole and cook for 15 mins. Remove from the heat and leave to sit for another 15 mins, then stir through the mirin. Remove the lid and give it a good stir. Serve with any or all of the optional toppings.",,http://res-2.cloudinary.com/dt1gn6erd/image/upload/v1634570641/tk0rcyofvs12aqmszdun.jpg,9
