id,name,instructions,total_time,image,category_id
52853,Chocolate Avocado Mousse,"1. Blend all the mousse ingredients together in your food processor until smooth. Add the cacao powder first and, as you blend, have all the ingredients to hand in order to adjust the ratios slightly as the size of avocados and bananas varies so much. The perfect ratio in order to avoid the dish tasting too much of either is to use equal amounts of both.

2. Taste and add a few drops of stevia if you feel you need more sweetness.

3. Fill little cups or shot glasses with the mousse, sprinkle with the cacao powder or nibs and serve.

Tip If you don’t have a frozen banana to hand you can just use a normal one and then chill the mousse before serving for a cooling dessert.",,http://res-4.cloudinary.com/dt1gn6erd/image/upload/v1634570787/wpyiwy0ggifemowvs7s8.jpg,3
52851,Nutty Chicken Curry,"Finely slice a quarter of the chilli, then put the rest in a food processor with the ginger, garlic, coriander stalks and one-third of the leaves. Whizz to a rough paste with a splash of water if needed.
Heat the oil in a frying pan, then quickly brown the chicken chunks for 1 min. Stir in the paste for another min, then add the peanut butter, stock and yogurt. When the sauce is gently bubbling, cook for 10 mins until the chicken is just cooked through and sauce thickened. Stir in most of the remaining coriander, then scatter the rest on top with the chilli, if using. Eat with rice or mashed sweet potato.",,http://res-5.cloudinary.com/dt1gn6erd/image/upload/v1634570915/tnntof3qltz6rhr6j5s0.jpg,2
52850,Chicken Couscous,"Heat the olive oil in a large frying pan and cook the onion for 1-2 mins just until softened. Add the chicken and fry for 7-10 mins until cooked through and the onions have turned golden. Grate over the ginger, stir through the harissa to coat everything and cook for 1 min more.

Tip in the apricots, chickpeas and couscous, then pour over the stock and stir once. Cover with a lid or tightly cover the pan with foil and leave for about 5 mins until the couscous has soaked up all the stock and is soft. Fluff up the couscous with a fork and scatter over the coriander to serve. Serve with extra harissa, if you like.",,http://res-4.cloudinary.com/dt1gn6erd/image/upload/v1634570786/zminagjax9m6imxtwg3x.jpg,2
52848,Bean & Sausage Hotpot,"In a large casserole, fry the sausages until brown all over – about 10 mins.

Add the tomato sauce, stirring well, then stir in the beans, treacle or sugar and mustard. Bring to the simmer, cover and cook for 30 mins. Great served with crusty bread or rice.",,http://res-3.cloudinary.com/dt1gn6erd/image/upload/v1634569586/m0bojs3ptdvahcs4weus.jpg,5
52847,Pork Cassoulet,"Heat oven to 140C/120C fan/gas 1. Put a large ovenproof pan (with a tight-fitting lid) on a high heat. Add your fat and diced meat, cook for a few mins to seal the edges, giving it a quick stir to cook evenly. Reduce the heat to low, add the sliced onion, whole garlic cloves, carrot and fennel seeds, and cook gently to soften the veg for a few mins.
Pour over the red wine vinegar, scraping any meaty bits off the bottom of the pan. Add the stock, tomato purée, and half the rosemary and parsley. Bring to the boil and simmer for 10 mins, then season, cover with a lid and put into the oven for 2 hrs, removing the lid for the final hour of cooking. Stir occasionally and add the beans with 30 mins to go.
Remove the pan from the oven and heat the grill. Scatter the top with the remaining herbs and breadcrumbs, drizzle a little oil over the top, and return to the oven for 5-10 mins, until the breadcrumbs are golden. Serve with crusty bread and green veg.",,http://res-4.cloudinary.com/dt1gn6erd/image/upload/v1634569445/agcyuzahc3somnphoqdz.jpg,7
52846,Chicken & mushroom Hotpot,"Heat oven to 200C/180C fan/gas 6. Put the butter in a medium-size saucepan and place over a medium heat. Add the onion and leave to cook for 5 mins, stirring occasionally. Add the mushrooms to the saucepan with the onions.

Once the onion and mushrooms are almost cooked, stir in the flour – this will make a thick paste called a roux. If you are using a stock cube, crumble the cube into the roux now and stir well. Put the roux over a low heat and stir continuously for 2 mins – this will cook the flour and stop the sauce from having a floury taste.

Take the roux off the heat. Slowly add the fresh stock, if using, or pour in 500ml water if you’ve used a stock cube, stirring all the time. Once all the liquid has been added, season with pepper, a pinch of nutmeg and mustard powder. Put the saucepan back onto a medium heat and slowly bring it to the boil, stirring all the time. Once the sauce has thickened, place on a very low heat. Add the cooked chicken and vegetables to the sauce and stir well. Grease a medium-size ovenproof pie dish with a little butter and pour in the chicken and mushroom filling.

Carefully lay the potatoes on top of the hot-pot filling, overlapping them slightly, almost like a pie top.

Brush the potatoes with a little melted butter and cook in the oven for about 35 mins. The hot-pot is ready once the potatoes are cooked and golden brown.",,http://res-3.cloudinary.com/dt1gn6erd/image/upload/v1634570784/tk0hcxut7nwz9miy3aoo.jpg,2
52844,Lasagne,"Heat the oil in a large saucepan. Use kitchen scissors to snip the bacon into small pieces, or use a sharp knife to chop it on a chopping board. Add the bacon to the pan and cook for just a few mins until starting to turn golden. Add the onion, celery and carrot, and cook over a medium heat for 5 mins, stirring occasionally, until softened.
Add the garlic and cook for 1 min, then tip in the mince and cook, stirring and breaking it up with a wooden spoon, for about 6 mins until browned all over.
Stir in the tomato purée and cook for 1 min, mixing in well with the beef and vegetables. Tip in the chopped tomatoes. Fill each can half full with water to rinse out any tomatoes left in the can, and add to the pan. Add the honey and season to taste. Simmer for 20 mins.
Heat oven to 200C/180C fan/gas 6. To assemble the lasagne, ladle a little of the ragu sauce into the bottom of the roasting tin or casserole dish, spreading the sauce all over the base. Place 2 sheets of lasagne on top of the sauce overlapping to make it fit, then repeat with more sauce and another layer of pasta. Repeat with a further 2 layers of sauce and pasta, finishing with a layer of pasta.
Put the crème fraîche in a bowl and mix with 2 tbsp water to loosen it and make a smooth pourable sauce. Pour this over the top of the pasta, then top with the mozzarella. Sprinkle Parmesan over the top and bake for 25–30 mins until golden and bubbling. Serve scattered with basil, if you like.",,http://res-2.cloudinary.com/dt1gn6erd/image/upload/v1634570900/yvzvfeiaquym3gtlvcyf.jpg,6
52843,Lamb Tagine,"Heat the olive oil in a heavy-based pan and add the onion and carrot. Cook for 3- 4 mins until softened.

Add the diced lamb and brown all over. Stir in the garlic and all the spices and cook for a few mins more or until the aromas are released.

Add the honey and apricots, crumble in the stock cube and pour over roughly 500ml boiling water or enough to cover the meat. Give it a good stir and bring to the boil. Turn down to a simmer, put the lid on and cook for 1 hour.

Remove the lid and cook for a further 30 mins, then stir in the squash. Cook for 20 – 30 mins more until the squash is soft and the lamb is tender. Serve alongside rice or couscous and sprinkle with parsley and pine nuts, if using.",,http://res-4.cloudinary.com/dt1gn6erd/image/upload/v1634570899/n78kxl8xog9phfrjkymw.jpg,4
52842,Broccoli & Stilton soup,"Heat the rapeseed oil in a large saucepan and then add the onions. Cook on a medium heat until soft. Add a splash of water if the onions start to catch.

Add the celery, leek, potato and a knob of butter. Stir until melted, then cover with a lid. Allow to sweat for 5 minutes. Remove the lid.

Pour in the stock and add any chunky bits of broccoli stalk. Cook for 10 – 15 minutes until all the vegetables are soft.

Add the rest of the broccoli and cook for a further 5 minutes. Carefully transfer to a blender and blitz until smooth. Stir in the stilton, allowing a few lumps to remain. Season with black pepper and serve.",,http://res-5.cloudinary.com/dt1gn6erd/image/upload/v1634569585/u1fbm1ayhgopvakyare0.jpg,10
52841,Creamy Tomato Soup,"Put the oil, onions, celery, carrots, potatoes and bay leaves in a big casserole dish, or two saucepans. Fry gently until the onions are softened – about 10-15 mins. Fill the kettle and boil it.
Stir in the tomato purée, sugar, vinegar, chopped tomatoes and passata, then crumble in the stock cubes. Add 1 litre boiling water and bring to a simmer. Cover and simmer for 15 mins until the potato is tender, then remove the bay leaves. Purée with a stick blender (or ladle into a blender in batches) until very smooth. Season to taste and add a pinch more sugar if it needs it. The soup can now be cooled and chilled for up to 2 days, or frozen for up to 3 months.
To serve, reheat the soup, stirring in the milk – try not to let it boil. Serve in small bowls with cheesy sausage rolls.",,http://res-5.cloudinary.com/dt1gn6erd/image/upload/v1634570783/d4ckxwhi3oi4vvnxnbmt.jpg,10
52840,Clam chowder,"Rinse the clams in several changes of cold water and drain well. Tip the clams into a large pan with 500ml of water. Cover, bring to the boil and simmer for 2 mins until the clams have just opened. Tip the contents of the pan into a colander over a bowl to catch the clam stock. When cool enough to handle, remove the clams from their shells – reserving a handful of empty shells for presentation if you want. Strain the clam stock into a jug, leaving any grit in the bottom of the bowl. You should have around 800ml stock.
Heat the butter in the same pan and sizzle the bacon for 3-4 mins until it starts to brown. Stir in the onion, thyme and bay and cook everything gently for 10 mins until the onion is soft and golden. Scatter over the flour and stir in to make a sandy paste, cook for 2 mins more, then gradually stir in the clam stock then the milk and the cream.
Throw in the potatoes, bring everything to a simmer and leave to bubble away gently for 10 mins or until the potatoes are cooked. Use a fork to crush a few of the potato chunks against the side of the pan to help thicken – you still want lots of defined chunks though. Stir through the clam meat and the few clam shells, if you've gone down that route, and simmer for a minute to reheat. Season with plenty of black pepper and a little salt, if needed, then stir through the parsley just before ladling into bowls or hollowed-out crusty rolls.",,http://res-1.cloudinary.com/dt1gn6erd/image/upload/v1634570782/ggs2udpe90uejeztizpi.jpg,10
52839,Chilli prawn linguine,"Mix the dressing ingredients in a small bowl and season with salt and pepper. Set aside.

Cook the pasta according to the packet instructions. Add the sugar snap peas for the last minute or so of cooking time.

Meanwhile, heat the oil in a wok or large frying pan, toss in the garlic and chilli and cook over a fairly gentle heat for about 30 seconds without letting the garlic brown. Tip in the prawns and cook over a high heat, stirring frequently, for about 3 minutes until they turn pink.

Add the tomatoes and cook, stirring occasionally, for 3 minutes until they just start to soften. Drain the pasta and sugar snaps well, then toss into the prawn mixture. Tear in the basil leaves, stir, and season with salt and pepper.

Serve with salad leaves drizzled with the lime dressing, and warm crusty bread.",,http://res-4.cloudinary.com/dt1gn6erd/image/upload/v1634570780/aypj21dsk9ncizcz0yh5.jpg,6
52837,Pilchard puttanesca,"Cook the pasta following pack instructions. Heat the oil in a non-stick frying pan and cook the onion, garlic and chilli for 3-4 mins to soften. Stir in the tomato purée and cook for 1 min, then add the pilchards with their sauce. Cook, breaking up the fish with a wooden spoon, then add the olives and continue to cook for a few more mins.

Drain the pasta and add to the pan with 2-3 tbsp of the cooking water. Toss everything together well, then divide between plates and serve, scattered with Parmesan.",,http://res-1.cloudinary.com/dt1gn6erd/image/upload/v1634569443/rfofjen5i3tehvf1kuak.jpg,6
52835,Fettucine alfredo,"In a medium saucepan, stir the clotted cream, butter and cornflour over a low-ish heat and bring to a low simmer. Turn off the heat and keep warm.
Meanwhile, put the cheese and nutmeg in a small bowl and add a good grinding of black pepper, then stir everything together (don’t add any salt at this stage).
Put the pasta in another pan with 2 tsp salt, pour over some boiling water and cook following pack instructions (usually 3-4 mins). When cooked, scoop some of the cooking water into a heatproof jug or mug and drain the pasta, but not too thoroughly.
Add the pasta to the pan with the clotted cream mixture, then sprinkle over the cheese and gently fold everything together over a low heat using a rubber spatula. When combined, splash in 3 tbsp of the cooking water. At first, the pasta will look wet and sloppy: keep stirring until the water is absorbed and the sauce is glossy. Check the seasoning before transferring to heated bowls. Sprinkle over some chives or parsley, then serve immediately.",,http://res-2.cloudinary.com/dt1gn6erd/image/upload/v1634570405/b6zywtlstsc1e9mwjyde.jpg,6
52834,Beef stroganoff,"Heat the olive oil in a non-stick frying pan then add the sliced onion and cook on a medium heat until completely softened, so around 15 mins, adding a little splash of water if they start to stick at all. Crush in the garlic and cook for a 2-3 mins further, then add the butter. Once the butter is foaming a little, add the mushrooms and cook for around 5 mins until completely softened. Season everything well, then tip onto a plate.
Tip the flour into a bowl with a big pinch of salt and pepper, then toss the steak in the seasoned flour. Add the steak pieces to the pan, splashing in a little oil if the pan looks particularly dry, and fry for 3-4 mins, until well coloured. Tip the onions and mushrooms back into the pan. Whisk the crème fraîche, mustard and beef stock together, then pour into the pan. Cook over a medium heat for around 5 mins. Scatter with parsley, then serve with pappardelle or rice.",,http://res-4.cloudinary.com/dt1gn6erd/image/upload/v1634569584/z2bqit8bkkkqsg3ercwq.jpg,1
52832,Coq au vin,"Heat 1 tbsp of the oil in a large, heavy-based saucepan or flameproof dish. Tip in the bacon and fry until crisp. Remove and drain on kitchen paper. Add the shallots to the pan and fry, stirring or shaking the pan often, for 5-8 mins until well browned all over. Remove and set aside with the bacon.
Pat the chicken pieces dry with kitchen paper. Pour the remaining oil into the pan, then fry half the chicken pieces, turning regularly, for 5-8 mins until well browned. Remove, then repeat with the remaining chicken. Remove and set aside.
Scatter in the garlic and fry briefly, then, with the heat medium-high, pour in the brandy or Cognac, stirring the bottom of the pan to deglaze. The alcohol should sizzle and start to evaporate so there is not much left.
Return the chicken legs and thighs to the pan along with any juices, then pour in a little of the wine, stirring the bottom of the pan again. Stir in the rest of the wine, the stock and tomato purée, drop in the bouquet garni, season with pepper and a pinch of salt, then return the bacon and shallots to the pan. Cover, lower the heat to a gentle simmer, add the chicken breasts and cook for 50 mins-1hr.
Just before ready to serve, heat the oil for the mushrooms in a large non-stick frying pan. Add the mushrooms and fry over a high heat for a few mins until golden. Remove and keep warm.
Lift the chicken, shallots and bacon from the pan and transfer to a warmed serving dish. Remove the bouquet garni. To make the thickener, mix the flour, olive oil and butter in a small bowl using the back of a teaspoon. Bring the wine mixture to a gentle boil, then gradually drop in small pieces of the thickener, whisking each piece in using a wire whisk. Simmer for 1-2 mins. Scatter the mushrooms over the chicken, then pour over the wine sauce. Garnish with chopped parsley.",,http://res-5.cloudinary.com/dt1gn6erd/image/upload/v1634570778/q1kfwhrzgsl0vjiefgex.jpg,2
52831,Chicken Karaage,"Add the ginger, garlic, soy sauce, sake and sugar to a bowl and whisk to combine. Add the chicken, then stir to coat evenly. Cover and refrigerate for at least 1 hour.

Add 1 inch of vegetable oil to a heavy bottomed pot and heat until the oil reaches 360 degrees F. Line a wire rack with 2 sheets of paper towels and get your tongs out. Put the potato starch in a bowl

Add a handful of chicken to the potato starch and toss to coat each piece evenly.

Fry the karaage in batches until the exterior is a medium brown and the chicken is cooked through. Transfer the fried chicken to the paper towel lined rack. If you want the karaage to stay crispy longer, you can fry the chicken a second time, until it's a darker color after it's cooled off once. Serve with lemon wedges.",,http://res-3.cloudinary.com/dt1gn6erd/image/upload/v1634570776/kfh9d2whapp6w0gc8qlg.jpg,2
52830,Crock Pot Chicken Baked Tacos,"Put the uncooked chicken breasts in the crock pot. Pour the full bottle of salad dressing over the chicken. Sprinkle the rest of the ingredients over the top and mix them in a bit with a spoon.
Cover your crock pot with the lid and cook on high for 4 hours.
Remove all the chicken breasts from the crock pot and let cool.
Shred the chicken breasts and move to a glass bowl.
Pour most of the liquid over the shredded chicken.
FOR THE TACOS:
Make the guacamole sauce by mixing the avocado and green salsa together. Pour the guacamole mixture through a strainer until smooth and transfer to a squeeze bottle. Cut the tip off the lid of the squeeze bottle to make the opening more wide if needed.
Make the sour cream sauce by mixing the sour cream and milk together until you get a more liquid sour cream sauce. Transfer to a squeeze bottle.
In a 9x 13 glass baking dish, fill all 12+ tacos with a layer of refried beans, cooked chicken and shredded cheese.
Bake at 450 for 10-15 minutes just until the cheese is melted and bubbling.
Out of the oven top all the tacos with the sliced grape tomaotes, jalapeno and cilantro.
Finish with a drizzle of guacamole and sour cream.
Enjoy!",,http://res-5.cloudinary.com/dt1gn6erd/image/upload/v1634570775/ecbrbe9snfrgyl6ny0ml.jpg,2
52829,Grilled Mac and Cheese Sandwich,"Make the mac and cheese

1. Bring a medium saucepan of generously salted water (you want it to taste like seawater) to a boil. Add the pasta and cook, stirring occasionally, until al dente, 8 to 10 minutes, or according to the package directions. The pasta should be tender but still chewy.
2. While the pasta is cooking, in a small bowl, whisk together the flour, mustard powder, garlic powder, salt, black pepper, and cayenne pepper.
3. Drain the pasta in a colander. Place the empty pasta pan (no need to wash it) over low heat and add the butter. When the butter has melted, whisk in the flour mixture and continue to cook, whisking frequently, until the mixture is beginning to brown and has a pleasant, nutty aroma, about 1 minute. Watch carefully so it does not scorch on the bottom of the pan.
4. Slowly whisk the milk and cream into the flour mixture until everything is really well combined. Cook, whisking constantly, until the sauce is heated through and just begins to thicken, about 2 minutes. Remove from the heat. Gradually add the cheese while stirring constantly with a wooden spoon or silicone spatula and keep stirring until the cheese has melted into the sauce. Then stir in the drained cooked pasta.
5. Line a 9-by-13-inch (23-by-33-centimeter) rimmed baking sheet with parchment paper or aluminum foil. Coat the paper or foil with nonstick cooking spray or slick it with butter. Pour the warm mac and cheese onto the prepared baking sheet and spread it evenly with a spatula. Coat another piece of parchment paper with cooking spray or butter and place it, oiled or buttered side down, directly on the surface of the mac and cheese. Refrigerate until cool and firm, about 1 hour.

Make the grilled cheese
6. Heat a large cast-iron or nonstick skillet over medium-low heat.
7. In a small bowl, stir together the 4 tablespoons (55 grams) butter and garlic powder until well blended.
8. Remove the mac and cheese from the refrigerator and peel off the top layer of parchment paper. Carefully cut into 8 equal pieces. Each piece will make 1 grilled mac and cheese sandwich. (You can stash each individual portion in a double layer of resealable plastic bags and refrigerate for up to 3 days or freeze it for up to 1 month.)
9. Spread 3/4 teaspoon garlic butter on one side of each bread slice. Place half of the slices, buttered-side down, on a clean cutting board. Top each with one slice of Cheddar, then 1 piece of the mac and cheese. (Transfer from the baking sheet by scooting your hand or a spatula under each piece of mac and cheese and then flipping it over onto a sandwich.) Place 1 slice of Jack on top of each. Finish with the remaining bread slices, buttered-side up.
10. Using a wide spatula, place as many sandwiches in the pan as will fit without crowding it. Cover and cook until the bottoms are nicely browned, about 4 minutes. Turn and cook until the second sides are browned, the cheese is melted, and the mac and cheese is heated through, about 4 minutes more.
11. Repeat with the remaining ingredients. Cut the sandwiches in half, if desired, and serve.",,http://res-1.cloudinary.com/dt1gn6erd/image/upload/v1634570834/ssnmwixkjcggu9tfo1hq.jpg,6
52827,Massaman Beef curry,"Heat oven to 200C/180C fan/gas 6, then roast the peanuts on a baking tray for 5 mins until golden brown. When cool enough to handle, roughly chop. Reduce oven to 180C/160C fan/gas 4.
Heat 2 tbsp coconut cream in a large casserole dish with a lid. Add the curry paste and fry for 1 min, then stir in the beef and fry until well coated and sealed. Stir in the rest of the coconut with half a can of water, the potatoes, onion, lime leaves, cinnamon, tamarind, sugar, fish sauce and most of the peanuts. Bring to a simmer, then cover and cook for 2 hrs in the oven until the beef is tender.
Sprinkle with sliced chilli and the remaining peanuts, then serve straight from the dish with jasmine rice.",,http://res-4.cloudinary.com/dt1gn6erd/image/upload/v1634570676/rfs7ogz161dwysp16zhb.jpg,1
52826,Braised Beef Chilli,"Preheat the oven to 120C/225F/gas mark 1.

Take the meat out of the fridge to de-chill. Pulse the onions and garlic in a food processor until finely chopped. Heat 2 tbsp olive oil in a large casserole and sear the meat on all sides until golden.

Set to one side and add another small slug of oil to brown the chorizo. Remove and add the onion and garlic, spices, herbs and chillies then cook until soft in the chorizo oil. Season with salt and pepper and add the vinegar, tomatoes, ketchup and sugar.

Put all the meat back into the pot with 400ml water (or red wine if you prefer), bring up to a simmer and cook, covered, in the low oven.

After 2 hours, check the meat and add the beans. Cook for a further hour and just before serving, pull the meat apart with a pair of forks.",,http://res-5.cloudinary.com/dt1gn6erd/image/upload/v1634569583/mgy8x4bmcg0awegkmwyk.jpg,1
52824,Beef Sunday Roast,"Cook the Broccoli and Carrots in a pan of boiling water until tender.

Roast the Beef and Potatoes in the oven for 45mins, the potatoes may need to be checked regularly to not overcook.

To make the Yorkshire puddings:
Heat oven to 230C/fan 210C/gas 8. Drizzle a little sunflower oil evenly into 2 x 4-hole Yorkshire pudding tins or a 12-hole non-stick muffin tin and place in the oven to heat through
To make the batter, tip 140g plain flour into a bowl and beat in four eggs until smooth. Gradually add 200ml milk and carry on beating until the mix is completely lump-free. Season with salt and pepper. Pour the batter into a jug, then remove the hot tins from the oven. Carefully and evenly pour the batter into the holes. Place the tins back in the oven and leave undisturbed for 20-25 mins until the puddings have puffed up and browned. Serve immediately.

Plate up and add the Gravy as desired.",,http://res-5.cloudinary.com/dt1gn6erd/image/upload/v1634569582/txv9hrxcgxxtljgtpkms.jpg,1
52821,Laksa King Prawn Noodles,"Heat the oil in a medium saucepan and add the chilli. Cook for 1 min, then add the curry paste, stir and cook for 1 min more. Dissolve the stock cube in a large jug in 700ml boiling water, then pour into the pan and stir to combine. Tip in the coconut milk and bring to the boil.
Add the fish sauce and a little seasoning. Toss in the noodles and cook for a further 3-4 mins until softening. Squeeze in the lime juice, add the prawns and cook through until warm, about 2-3 mins. Scatter over some of the coriander.
Serve in bowls with the remaining coriander and lime wedges on top for squeezing over.",,http://res-1.cloudinary.com/dt1gn6erd/image/upload/v1634570897/vegwqut4tnm3bscroeah.jpg,8
